id,month,type,placename,state,state_abbrev,state_fips,countyname,countyfips,ideology,group,description
1368,6,Anti-Semitic Incident:Harassment,Los Angeles,California,CA,6,Los Angeles,37,,,Confidential
2403,6,Anti-Semitic Incident:Harassment,Swampscott,Massachusetts,MA,25,Essex,9,,,Anti-Semitic post discovered on school educational game.
1085,6,Anti-Semitic Incident:Harassment,Rowley,Massachusetts,MA,25,Essex,9,,, while negotiating his salary.
2383,6,Terrorist Plot/Attack,Stockton,Utah,UT,49,Tooele,45,Right Wing (Anti-Government),,"William Keebler was arrested in June 2016 after allegedly attempting to set off a bomb at a Bureau of Land Management facility in Arizona. He was charged with one count of attempted damage to a federal facility by means of fire or explosive. In April 2018, he pleaded guilty to one count of attempted destruction of federal property by use of an explosive."
1452,6,Anti-Semitic Incident:Assault,Mamaroneck,New York,NY,36,Westchester,119,,, and physically assaulted by man while at bar.
652,6,Anti-Semitic Incident:Vandalism,Portland,Maine,ME,23,Cumberland,5,,,White supremacist symbol etched into synagogue building.
2649,6,Anti-Semitic Incident:Harassment,Weston,Connecticut,CT,,Fairfield,1,,,Confidential
1010,6,Anti-Semitic Incident:Harassment,Greenfield,Massachusetts,MA,,Franklin,11,,,Confidential
2153,6,Anti-Semitic Incident:Harassment,San Diego,California,CA,6,San Diego,73,,,Jewish organization received fax containing anti-Semitic literature claiming Orthodox Jews collaborated with Nazis.
2557,6,Anti-Semitic Incident:Vandalism,Warrington,Pennsylvania,PA,,Bucks,17,,,Elementary school sign vandalized with swastika.
1904,6,Anti-Semitic Incident:Harassment,Pembroke,Massachusetts,MA,,Plymouth,23,,, written in middle school student's yearbook.
1009,6,Anti-Semitic Incident:Harassment,Greenfield,Massachusetts,MA,,Franklin,11,,,Employees of local coffee shop were victims of anti-Semitic threats and harassment.
2036,6,Anti-Semitic Incident:Vandalism,East Rockaway,New York,NY,36,Nassau,59,,,Anti-semitic messages written on wall.
649,6,Anti-Semitic Incident:Harassment,Concord,New Hampshire,NH,33,Merrimack,13,,,Individual target of anti-Semitic harassment on social media.
1891,7,Anti-Semitic Incident:Vandalism,Brooklyn,New York,NY,,Kings,47,,,
2654,7,Anti-Semitic Incident:Vandalism,Westport,Connecticut,CT,9,Fairfield,1,,, spray painted in public pavillion.
2494,7,Terrorist Plot/Attack,Tucson,Arizona,AZ,4,Pima,19,Islamist,,"Mahin Khan plotted to attack an Air Force recruitment center in Tucson, AZ."
2356,7,Anti-Semitic Incident:Harassment,Stamford,Connecticut,CT,9,Fairfield,1,,,Confidential
8161,7,Extremist Murder,Hemet,California,CA,6,Riverside,65,Right Wing (White Supremacist),Coors Family Skins,"Noy Estel Boukes, a member of the Coors Family Skins racist skinhead gang, allegedly shot a man to death at the order of the Aryan Brotherhood because the victim had not paid alleged drug-related debts."
1844,7,Anti-Semitic Incident:Harassment,Omaha,Nebraska,NE,31,Douglas,55,,,"Networked printer in private home hacked, printed anti-Semitic, white supremacist flyers."
710,7,Terrorist Plot/Attack,Daytona Beach,Florida,FL,12,Volusia,127,Left Wing,,
2485,7,Anti-Semitic Incident:Vandalism,Toms River,New Jersey,NJ,34,Ocean,29,,,Swastika spray-painted on synagogue.
1225,7,Anti-Semitic Incident:Harassment,Lacey,New Jersey,NJ,,Ocean,29,,,
2704,7,Anti-Semitic Incident:Harassment,Los Angeles,California,CA,,Los Angeles,37,,,Confidential
1554,7,Anti-Semitic Incident:Harassment,Miami,Florida,FL,12,Miami-Dade,86,,,Confidential
1539,7,Anti-Semitic Incident:Vandalism,Mesa,Arizona,AZ,4,Maricopa,13,,,Swastikas spray-painted on individual's house.
2074,7,Anti-Semitic Incident:Vandalism,Riverside,California,CA,6,Riverside,65,,, graffiti found for third time on UC Riverside campus.
2307,7,Anti-Semitic Incident:Vandalism,Somerville,Massachusetts,MA,25,Middlesex,17,,,Swastika keyed into the side of car.
738,7,Anti-Semitic Incident:Harassment,Denver,Colorado,CO,8,Denver,31,,, by pro-ISIS hackers.
661,7,Anti-Semitic Incident:Vandalism,Coral Springs,Florida,FL,12,Broward,11,,,Swastika carved into cement.
647,7,Anti-Semitic Incident:Harassment,Sandy Springs,Georgia,GA,13,Fulton,121,,, by another resident of her Homeowner's Association.
347,7,Anti-Semitic Incident:Assault,San Francisco,California,CA,6,San Francisco,75,,,Elderly woman attacked in park by woman who threatened her with anti-Semitic slurs.
2037,7,Anti-Semitic Incident:Harassment,Rancho Mirage,California,CA,6,Riverside,65,,,Confidential.
33,7,Terrorist Plot/Attack,Alexandria,Virginia,VA,51,Alexandria city,510,Islamist,,Mohamed Bailor Jalloh was arrested after unsuccessfully attempting to purchase an AR-15 as part of a plot to murder U.S. military personnel.
2500,7,Extremist Murder,Turkey Creek,Louisiana,LA,22,Evangeline Parish,39,Right Wing (White Supremacist),Aryan Circle Motorcycle Club,"David Wayne Williams, leader of the Aryan Circle Motorcycle club, was charged with accessory to murder. Two additional AC members were also implicated in the murder."
15,7,Anti-Semitic Incident:Harassment,Albuquerque,New Mexico,NM,35,Bernalillo,1,,,Individual victim of anti-Semitic and racist harassment in their apartment complex.
1398,7,Anti-Semitic Incident:Vandalism,Los Angeles,California,CA,6,Los Angeles,37,,,Swastika painted on synagogue walls.
108,7,Anti-Semitic Incident:Harassment,Atlanta,Georgia,GA,13,Fulton,121,,,Receptionist received harassing anti-Semitic phone call.
2209,7,Anti-Semitic Incident:Harassment,San Marcos,California,CA,6,San Diego,73,,, written in middle school student's yearbook.
901,7,Anti-Semitic Incident:Harassment,Fort Lauderdale,Florida,FL,12,Broward,11,,,
1593,7,Anti-Semitic Incident:Harassment,Milwaukee,Wisconsin,WI,55,Milwaukee,79,,,A Jewish family victim of anti-Semitic harassment.
2634,7,Anti-Semitic Incident:Harassment,West Palm Beach,Florida,FL,12,Palm Beach,99,,,Restaurant server found anti-Semitic messages left on table.
1819,7,Anti-Semitic Incident:Harassment,Ocean,New Jersey,NJ,,Monmouth,25,,,Individual targeted with anti-Semitic Snapchat messages.
2031,7,Anti-Semitic Incident:Vandalism,Coram,New York,NY,36,Suffolk,103,,,
2703,7,Extremist Murder,Woodland,Washington,WA,53,Cowlitz,15,Right Wing (White Supremacist),,"Brent Luyster, 35, a long-time white supremacist, shot and killed three of his friends, possibly because he feared that authorities were building a weapons case against him, and he thought his friends might be collaborating with the investigators."
465,7,Anti-Semitic Incident:Assault,Boca Raton,Florida,FL,12,Palm Beach,99,,,Individual was the victim of anti-Semitic harassment.
2073,7,Anti-Semitic Incident:Vandalism,Riverside,California,CA,6,Riverside,65,,, found on the UC Riverside campus.
1086,7,Anti-Semitic Incident:Vandalism,Salem,Massachusetts,MA,25,Essex,9,,,Anti-Semitic graffiti found in public park.
195,7,Terrorist Plot/Attack;Extremist Murder;Extremist/Police Shootout,Baton Rouge,Louisiana,LA,22,East Baton Rouge Parish,33,Left Wing,,"Law enforcement killed anti-government extremist Gavin Eugene Long after he ambushed officers responding to a call about a suspicious person with an assault rifle. Long shot and killed three officers, and then in a second shootout at a different location, he injured three additional officers."
1327,7,Anti-Semitic Incident:Harassment,Howell,New Jersey,NJ,,Monmouth,25,,,
2,7,Anti-Semitic Incident:Harassment,Aberdeen,New Jersey,NJ,,Monmouth,25,,, and gave a Nazi salute to Jewish victim.
1474,7,Anti-Semitic Incident:Harassment,Paterson,New Jersey,NJ,34,Passaic,31,,,Anti-Semitic remarks made in reference to fire at national park.
1537,7,Anti-Semitic Incident:Harassment,Bethpage,New York,NY,36,Nassau,59,,,Playground vandalized with anti-Semitic messages.
2005,7,Anti-Semitic Incident:Vandalism,Princeton,New Jersey,NJ,34,Mercer,21,,,Chalk drawings of swastikas discovered on chalkboards throughout two resident halls.
1260,7,Anti-Semitic Incident:Harassment,Lakewood,New Jersey,NJ,34,Ocean,29,,, and other anti-Semitic slurs at Jewish woman sitting on her porch.
739,7,Anti-Semitic Incident:Harassment,Denver,Colorado,CO,8,Denver,31,,,Man entered synagogue and verbally harassed employees with anti-Semitic language.
2058,7,Anti-Semitic Incident:Harassment,Los Angeles,California,CA,,Los Angeles,37,,,Confidential.
1510,7,Anti-Semitic Incident:Vandalism,Los Angeles,California,CA,,Los Angeles,37,,,Two swastikas drawn on elevator door buttons in an apartment building.
1712,7,Anti-Semitic Incident:Vandalism,New Brunswick,New Jersey,NJ,34,Middlesex,23,,, written in black ink in student center bathroom.
2236,7,Anti-Semitic Incident:Harassment,Santa Fe,New Mexico,NM,35,Santa Fe,49,,,Confidential
349,7,Anti-Semitic Incident:Harassment,San Francisco,California,CA,6,San Francisco,75,,,Religious group held public meeting in park and discussed genocide of the Jews as a good thing.
1919,7,Anti-Semitic Incident:Harassment,Philadelphia,Pennsylvania,PA,42,Philadelphia,101,,,
1397,7,Anti-Semitic Incident:Vandalism,Los Angeles,California,CA,6,Los Angeles,37,,,Valuable object donated to the University of Southern California damaged by anti-Semitic graffiti.
1660,7,Anti-Semitic Incident:Vandalism,Mount Laurel,New Jersey,NJ,,Burlington,5,,,Swastika drawn in marker on Jewish person's mailbox.
1659,7,Anti-Semitic Incident:Vandalism,Mount Laurel,New Jersey,NJ,,Burlington,5,,,Home defaced with swastika graffiti.
2068,7,Anti-Semitic Incident:Vandalism,Great River,New York,NY,36,Suffolk,103,,,
217,7,Anti-Semitic Incident:Vandalism,Bellmore,New York,NY,36,Nassau,59,,,Car vandalized with swastika.
1658,7,Anti-Semitic Incident:Vandalism,Mount Laurel,New Jersey,NJ,,Burlington,5,,,Confidential
1061,7,Anti-Semitic Incident:Vandalism,Newton,Massachusetts,MA,25,Middlesex,17,,,Swastika made of blocks found outside church.
1266,7,Anti-Semitic Incident:Vandalism,Lakewood,New Jersey,NJ,34,Ocean,29,,,Swastika was drawn on Jewish school.
2082,7,Anti-Semitic Incident:Vandalism,Lindenhurst,New York,NY,36,Suffolk,103,,,Vehicle scratched and vandalized with swastika.
1371,7,Anti-Semitic Incident:Harassment,Los Angeles,California,CA,6,Los Angeles,37,,,Synagogue received package containing anti-Semitic literature.
213,7,Anti-Semitic Incident:Vandalism,Bellevue,Washington,WA,53,King,33,,, written on car window.
1657,7,Anti-Semitic Incident:Vandalism,Mount Laurel,New Jersey,NJ,,Burlington,5,,,Jewish resident reported swastika drawn on outside wall of his residence.
334,7,Extremist Murder,Bristol,Tennessee,TN,47,Sullivan,163,Left Wing,,"Lakeem Keon Scott opened fire on police officers and civilians, killing one and injuring four others. He claimed he carried out the attack because he was upset about the deaths of African-Americans at the hands of authorities in Louisiana and Minnesota."
1900,7,Anti-Semitic Incident:Vandalism,Brooklyn,New York,NY,,Kings,47,,,Eleven Jewish people's tires slashed.
687,7,Extremist Murder;Extremist/Police Shootout;Terrorist Plot/Attack,Dallas,Texas,TX,48,Dallas,113,Left Wing,,"Micah Xavier Johnson, a black nationalist, opened fire on police officers guarding a protest, killing five and wounding nine more in retaliation for an earlier police shooting. During a subsequent standoff he said he wanted to kill white people, especially white police officers. He was killed by police during the standoff."
750,8,Anti-Semitic Incident:Vandalism,Denver,Colorado,CO,8,Denver,31,,,Real estate sign was vandalized with swastika graffiti.
20,8,Anti-Semitic Incident:Vandalism,Albuquerque,New Mexico,NM,35,Bernalillo,1,,,Swastika graffiti found on sidewalk at University of New Mexico.
8162,8,Extremist Murder,Jessup,Maryland,MD,24,Anne Arundel,3,Right Wing (White Supremacist),Maryland Aryan Brotherhood,Four members of the Maryland Aryan Brotherhood allegedly stabbed to death a member of a rival gang at Jessup Correctional Institution.
2154,8,Anti-Semitic Incident:Harassment,San Diego,California,CA,6,San Diego,73,,,Middle school teacher assigned an anti-Semitic and pseudo-historical book that demonized Israeli Jews.
2636,8,Anti-Semitic Incident:Harassment,West Palm Beach,Florida,FL,12,Palm Beach,99,,,Jewish institution received two faxes from different sources containing swastikas.
981,8,Anti-Semitic Incident:Harassment,Glendale,California,CA,6,Los Angeles,37,,, after his wallet was returned to him by a Jewish peer.
2520,8,Anti-Semitic Incident:Harassment,Los Angeles,California,CA,,Los Angeles,37,,,Confidential
1338,8,Anti-Semitic Incident:Harassment,Long Beach,California,CA,6,Los Angeles,37,,,Elementary school teacher performed Nazi salute to class during the United States Pledge of Allegiance.
341,8,Anti-Semitic Incident:Vandalism,Bronx,New York,NY,,Bronx,5,,,
2023,8,Anti-Semitic Incident:Vandalism,Queens,New York,NY,,Queens,81,,,
2189,8,Anti-Semitic Incident:Harassment,San Francisco,California,CA,6,San Francisco,75,,,Homeowners refused to remove painted swastika from their front door despite neighbor's request.
110,8,Anti-Semitic Incident:Harassment,Atlanta,Georgia,GA,13,Fulton,121,,,News outlet received series of email and faxes with racist and anti-Semitic content.
329,8,Anti-Semitic Incident:Vandalism,San Diego,California,CA,6,San Diego,73,,,Swastika etched into a sidewalk.
1778,8,Anti-Semitic Incident:Harassment,Brooklyn,New York,NY,,Kings,47,,,Two Jewish men threatened by passerby.
1325,8,Anti-Semitic Incident:Vandalism,Howell,New Jersey,NJ,,Monmouth,25,,,Swastikas spray-painted at park frequented by Hasidic Jews.
961,8,Anti-Semitic Incident:Vandalism,Galloway,New Jersey,NJ,,Atlantic,1,,,Swastika carved into table in campus building.
677,8,Anti-Semitic Incident:Vandalism,Culver City,California,CA,6,Los Angeles,37,,, scratched on the trunk.
2357,8,Anti-Semitic Incident:Harassment,Stamford,Connecticut,CT,9,Fairfield,1,,,Confidential
1253,8,Anti-Semitic Incident:Harassment,Lakeville,Minnesota,MN,27,Dakota,37,,,Anti-Semitic remarks made at fundraising event.
911,8,Extremist Murder,Fort Wayne,Indiana,IN,18,Allen,3,Right Wing (White Supremacist),,"White supremacist Aaryn Snider, 31, confessed to the murder of a black man while serving time for failing to register as a sex offender."
1372,8,Anti-Semitic Incident:Harassment,Los Angeles,California,CA,6,Los Angeles,37,,,Confidential
183,8,Anti-Semitic Incident:Vandalism,Los Angeles,California,CA,6,Los Angeles,37,,,Confidential
1624,8,Anti-Semitic Incident:Assault,Brooklyn,New York,NY,,Kings,47,,,Jewish woman physically assaulted.
40,8,Anti-Semitic Incident:Harassment,Allentown,Pennsylvania,PA,42,Lehigh,77,,,Congressman's office received fax filled with anti-Semitic content.
294,8,Anti-Semitic Incident:Vandalism,Boston,Massachusetts,MA,25,Suffolk,25,,,Swastika found in apartment building outside Jewish family's apartment.
2240,8,Anti-Semitic Incident:Vandalism,Santa Rosa,California,CA,6,Sonoma,97,,, found written on bathroom wall at Santa Rosa Junior College.
1003,8,Anti-Semitic Incident:Vandalism,Greeley,Colorado,CO,8,Weld,123,,,Synagogue vandalized.
1373,8,Anti-Semitic Incident:Harassment,Los Angeles,California,CA,6,Los Angeles,37,,,Confidential
1846,8,Anti-Semitic Incident:Harassment,Omaha,Nebraska,NE,31,Douglas,55,,,Synagogue received anti-Semitic hate mail.
427,8,Anti-Semitic Incident:Vandalism,Washington,District Of Columbia,DC,11,District of Columbia,1,,,
2038,8,Extremist/Police Shootout,Randallstown,Maryland,MD,24,Baltimore,5,Right Wing (Anti-Government),,"Police shot and killed anti-government extremist Korryn Gaines during a standoff-turned-shootout at her home, as they tried to serve arrest warrants on her and another occupant of the home.The officers were attempting to serve warrants on Gaines for failing to appear in court for a number of charges connected to a traffic stop."
1126,8,Anti-Semitic Incident:Vandalism,Huntington Beach,California,CA,6,Orange,59,,,Mezuzah smashed outside residential property.
2642,8,Anti-Semitic Incident:Vandalism,Kettle Moraine,Wisconsin,WI,,,,,,Swastika vandalism at park.
2699,8,Anti-Semitic Incident:Assault,Woodbridge,New Jersey,NJ,34,Middlesex,23,,,
1640,8,Anti-Semitic Incident:Assault,Brooklyn,New York,NY,,Kings,47,,,Confidential
2022,8,Anti-Semitic Incident:Vandalism,Queens,New York,NY,,Queens,81,,,Confidential
419,8,Anti-Semitic Incident:Vandalism,Washington,District Of Columbia,DC,11,District of Columbia,1,,,Confidential
1594,8,Anti-Semitic Incident:Harassment,Milwaukee,Wisconsin,WI,55,Milwaukee,79,,,A Jewish student was repeatedly targeted with anti-Semitic comments from other students.
555,8,Anti-Semitic Incident:Harassment,Chilmark,Massachusetts,MA,,Dukes,7,,,"Anti-Semitic message sent to building resident's fax, printer, copier and scanner."
2635,8,Anti-Semitic Incident:Harassment,West Palm Beach,Florida,FL,12,Palm Beach,99,,,Church received anti-Semitic faxes.
448,8,Anti-Semitic Incident:Vandalism,Washington,District Of Columbia,DC,11,District of Columbia,1,,,Two swastikas graffitied near a synagogue.
1468,8,Anti-Semitic Incident:Harassment,New York,New York,NY,36,Kings,47,,,Fundraising appeal for New York City Council candidate contained anti-Semitic messages and canards.
2419,8,Anti-Semitic Incident:Harassment,Tallahassee,Florida,FL,12,Leon,73,,,Florida State University received faxed flyers containing derogatory statements.
1089,8,Anti-Semitic Incident:Harassment,Houston,Texas,TX,48,Harris,201,,,Synagogue received packet in the mail that contained anti-Semitic comments.
1025,8,Anti-Semitic Incident:Harassment,Hammonton,New Jersey,NJ,34,Atlantic,1,,,Individual frequently harassed and threatened Jewish victim both on social media and at victim's office.
422,8,Anti-Semitic Incident:Harassment,Burbank,California,CA,6,Los Angeles,37,,,Jewish lay leader received anti-Semitic email from coworker accusing Jewish business owners of inhumane business practices overseas.
288,8,Anti-Semitic Incident:Harassment,Boston,Massachusetts,MA,25,Suffolk,25,,,Confidential
1400,8,Anti-Semitic Incident:Vandalism,Los Angeles,California,CA,6,Los Angeles,37,,, and swastikas.
109,8,Anti-Semitic Incident:Harassment,Atlanta,Georgia,GA,13,Fulton,121,,,Two hate letters containing anti-Semitic content and material about Jewish conspiracies faxed to Georgia State University .
1053,8,Anti-Semitic Incident:Vandalism,Haverford,Pennsylvania,PA,,Delaware,45,,,Trash can belonging to resident of Havertown vandalized with swastika.
1014,8,Extremist Murder,Gresham,Oregon,OR,41,Multnomah,51,Right Wing (White Supremacist),European Kindred,"Russell Courtier, a member of the white supremacist group European Kindred, ran over and killed an African American man after they got into an argument."
565,8,Anti-Semitic Incident:Harassment,Clayton,Missouri,MO,29,St. Louis,189,,,Woman entered Jewish institution and made anti-Semitic comments in reference to an employee.
346,8,Anti-Semitic Incident:Vandalism,Brookline,Massachusetts,MA,25,Norfolk,21,,,Anti-Semitic graffiti found in public park
2700,8,Anti-Semitic Incident:Harassment,Woodbridge,New Jersey,NJ,34,Middlesex,23,,,
1470,8,Anti-Semitic Incident:Vandalism,Linwood,New Jersey,NJ,34,Atlantic,1,,,Swastika painted on roadway.
1677,8,Anti-Semitic Incident:Harassment,Napa,California,CA,6,Napa,55,,,Woman with family who died in the Holocaust harassed by boss who made references to Nazis.
1638,8,Anti-Semitic Incident:Assault,Brooklyn,New York,NY,,Kings,47,,,"Jewish man physically assaulted with basketball, had his yarmulke forcibly removed."
1118,8,Anti-Semitic Incident:Harassment,Howell,New Jersey,NJ,,Monmouth,25,,,Jewish individual received anti-Semitic and vulgar text messages and voicemails.
2256,8,Anti-Semitic Incident:Harassment,Seattle,Washington,WA,53,King,33,,,Confidential
622,8,Anti-Semitic Incident:Harassment,Columbia,South Carolina,SC,45,Richland,79,,,Jewish organization received letter containing obscenities.
361,8,Anti-Semitic Incident:Assault,Brooklyn,New York,NY,,Kings,47,,,Three Jewish children were followed home from the school bus and had their yarmulkes forcibly removed.
1228,8,Anti-Semitic Incident:Harassment,Lincoln,Nebraska,NE,31,Lancaster,109,,,Confidential
27,8,Anti-Semitic Incident:Harassment,Agoura Hills,California,CA,6,Los Angeles,37,,, displayed on electronic road sign.
2512,8,Anti-Semitic Incident:Harassment,Upper Dublin,Pennsylvania,PA,,Montgomery,91,,, found in residential area.
713,8,Terrorist Plot/Attack,Dearborn,Michigan,MI,26,Wayne,163,Islamist,,"Sebastian Gregerson acquired an illegal arsenal of weapons including knives, ammunition, grenades, guns and tactical gear with the help of a Maryland imam. Court documents indicate that Gregerson plotted to carry out an attack on a building in support of ISIS."
150,8,Anti-Semitic Incident:Harassment,Austin,Texas,TX,48,Travis,453,,,Jewish institution received violent anti-Semitic materials sent to its wireless printers.
988,8,Anti-Semitic Incident:Harassment,Goodyear,Arizona,AZ,4,Maricopa,13,,,Student was target of anti-Semitic bullying.
1967,8,Anti-Semitic Incident:Vandalism,Point Pleasant,New Jersey,NJ,34,Ocean,29,,,Swastika graffiti discovered on apartment complex fence.
977,8,Extremist/Police Shootout,Gladstone,Oregon,OR,41,Clackamas,5,Right Wing (White Supremacist),,"Law enforcement officers shot white supremacist Jeffrey Carl Giddings after he took a woman hostage in a restaurant. Police had initially tried to pull Giddens over for a traffic violation. He fled and shot at the police officer who later found him, which led to the hostage situation."
1454,8,Anti-Semitic Incident:Vandalism,Lakewood,New Jersey,NJ,34,Ocean,29,,,Confidential
2312,8,Anti-Semitic Incident:Harassment,South Kingstown,Rhode Island,RI,,Washington,9,,,Anti-Semitic flyers distributed on and around campus.
1505,8,Anti-Semitic Incident:Harassment,Marblehead,Massachusetts,MA,25,Essex,9,,,Confidential
1845,8,Anti-Semitic Incident:Harassment,Omaha,Nebraska,NE,31,Douglas,55,,,Confidential
1374,8,Anti-Semitic Incident:Harassment,Los Angeles,California,CA,6,Los Angeles,37,,,Confidential
1248,8,Extremist/Police Shootout,Lakeland,Florida,FL,12,Polk,105,Right Wing (White Supremacist),,"Police shot and wounded white supremacist Francis Perry during a shootout after they stopped his vehicle to serve a fugitive arrest warrant. Perry had shot at police when they approached his vehicle and they returned fire, wounding him."
1682,8,Anti-Semitic Incident:Harassment,Naples,Florida,FL,12,Collier,21,,,Opposing candidate posted anti-Semitic comments on social media.
561,8,Anti-Semitic Incident:Vandalism,Clarkstown,New York,NY,,Rockland,87,,,Two Jewish leaders' residences attacked with incendiary devices.
2377,8,Anti-Semitic Incident:Vandalism,Queens,New York,NY,,Queens,81,,,
1697,8,Anti-Semitic Incident:Assault,Brooklyn,New York,NY,,Kings,47,,,Jewish man physically assaulted after asking someone for directions to synagogue.
180,8,Anti-Semitic Incident:Harassment,Aventura,Florida,FL,12,Miami-Dade,86,,,Jewish organization received anti-Semitic flyers.
1267,8,Anti-Semitic Incident:Vandalism,Lakewood,New Jersey,NJ,34,Ocean,29,,,Several swastikas spray-painted on jungle gym and building door at Jewish day school.
1269,8,Anti-Semitic Incident:Vandalism,Lakewood,New Jersey,NJ,34,Ocean,29,,,Swastikas discovered in stairwell at Jewish day school.
2117,8,Anti-Semitic Incident:Vandalism,New York,New York,NY,36,Kings,47,,,Subway station vandalized with two swastika drawings.
1975,8,Anti-Semitic Incident:Harassment,Port Chester,New York,NY,36,Westchester,119,,,Jewish student received text from his classmates that depicted him dying in a gas chamber.
114,9,Anti-Semitic Incident:Harassment,Lafayette,California,CA,6,Contra Costa,13,,,Anti-Semitic flyers referencing local high schools found on public transportation.
1981,9,Anti-Semitic Incident:Harassment,Portland,Oregon,OR,41,Multnomah,51,,,Resident's neighbor repeatedly yelled anti-Semitic slurs.
1788,9,Anti-Semitic Incident:Harassment,North Fort Myers,Florida,FL,12,Lee,71,,,Neighbor made anti-Semitic comments.
1341,9,Anti-Semitic Incident:Vandalism,Long Beach,California,CA,6,Los Angeles,37,,, written on base of campus statue.
289,9,Anti-Semitic Incident:Harassment,Boston,Massachusetts,MA,25,Suffolk,25,,,Swastika found scratched into desk at Northeastern law school library.
1378,9,Anti-Semitic Incident:Harassment,Los Angeles,California,CA,6,Los Angeles,37,,,Confidential
269,9,Anti-Semitic Incident:Harassment,Boca Raton,Florida,FL,12,Palm Beach,99,,,Student found book covered with anti-Semitic symbolism in history class.
1376,9,Anti-Semitic Incident:Harassment,Los Angeles,California,CA,6,Los Angeles,37,,,Hollywood executive targeted by anti-Semitic Twitter account.
45,9,Anti-Semitic Incident:Harassment,Alpharetta,Georgia,GA,13,Fulton,121,,,Store posted harassing anti-Semitic posters.
2619,9,Anti-Semitic Incident:Harassment,Wellington,Florida,FL,12,Palm Beach,99,,,Synagogue received hate mail.
1339,9,Anti-Semitic Incident:Harassment,Long Beach,California,CA,6,Los Angeles,37,,,Jewish middle school student harassed by classmate at school and via text and social media.
1754,9,Anti-Semitic Incident:Harassment,Newark,Delaware,DE,10,New Castle,3,,,Synagogue received hate literature in the mail.
1914,9,Anti-Semitic Incident:Vandalism,Brooklyn,New York,NY,,Kings,47,,,Inactive church vandalized with swastika.
1065,9,Anti-Semitic Incident:Harassment,Hillsborough,New Hampshire,NH,,Hillsborough,11,,,Anti-Semitic harassment online.
580,9,Anti-Semitic Incident:Vandalism,Brunswick,Georgia,GA,13,Glynn,127,,,Swastika drawn outside of the shop of a Jewish shopkeeper.
10,9,Anti-Semitic Incident:Harassment,Albany,New York,NY,36,Albany,1,,,Synagogue received anti-Semitic letter.
2196,9,Anti-Semitic Incident:Vandalism,San Jose,California,CA,6,Santa Clara,85,,,Swastikas and other anti-Semitic material found in college residence hall.
2279,9,Anti-Semitic Incident:Harassment,Sewell,New Jersey,NJ,,Gloucester,15,,,Synagogue received anti-Semitic hate literature.
