id,month,type,placename,state,state_abbrev,state_fips,countyname,countyfips,ideology,group,description
1971,9,Anti-Semitic Incident:Vandalism,Pompano Beach,Florida,FL,12,Broward,11,,, written in building elevator.
1072,9,Anti-Semitic Incident:Harassment,Hollywood,Florida,FL,12,Broward,11,,,Synagogue received anti-Semitic letter from extremist group.
1348,9,Anti-Semitic Incident:Vandalism,Howell,New Jersey,NJ,,Monmouth,25,,,Swastika vandalism discovered at public park frequented by members of local Jewish community.
253,9,Anti-Semitic Incident:Assault,Oceanside,California,CA,6,San Diego,73,,, and physically attacked a Jewish man.
1402,9,Anti-Semitic Incident:Vandalism,Los Angeles,California,CA,6,Los Angeles,37,,,Swastika painted on Holocaust memorial wall of Jewish institution.
2518,9,Anti-Semitic Incident:Harassment,Bloomsburg,Pennsylvania,PA,42,Columbia,37,,,Anti-Semitic paraphernalia sold at state fair.
395,9,Anti-Semitic Incident:Vandalism,Watertown,Connecticut,CT,9,Litchfield,5,,, spray-painted at multiple locations.
390,9,Anti-Semitic Incident:Vandalism,Milford,Connecticut,CT,,New Haven,9,,,Two swastikas spray-painted in park.
2543,9,Anti-Semitic Incident:Vandalism,Wallingford,Connecticut,CT,,New Haven,9,,,"Makeshift statue erected and dressed in KKK robes, performing Nazi salute."
63,9,Anti-Semitic Incident:Harassment,Ann Arbor,Michigan,MI,26,Washtenaw,161,,,Synagogue received anti-Semitic phone call.
1045,9,Anti-Semitic Incident:Harassment,Hartford,Connecticut,CT,9,Hartford,3,,,Confidential
78,9,Anti-Semitic Incident:Harassment,Arlington,Massachusetts,MA,25,Middlesex,17,,,Threatening flyer promoting known anti-Semitic figure placed in Jewish woman's mailbox.
2398,9,Anti-Semitic Incident:Harassment,Sunnyvale,California,CA,6,Santa Clara,85,,,
2083,9,Anti-Semitic Incident:Vandalism,Long Beach,New York,NY,36,Nassau,59,,,Confidential
392,9,Anti-Semitic Incident:Vandalism,Redding,Connecticut,CT,,Fairfield,1,,,Swastikas drawn on multiple stops signs.
1970,9,Anti-Semitic Incident:Harassment,Pompano Beach,Florida,FL,12,Broward,11,,,Anti-Semitic and homophobic language used in death threats and attacks on social media.
1595,9,Anti-Semitic Incident:Harassment,Milwaukee,Wisconsin,WI,55,Milwaukee,79,,,Confidential
2407,9,Anti-Semitic Incident:Vandalism,Swarthmore,Pennsylvania,PA,42,Delaware,45,,,School playground vandalized with swastika.
2085,9,Anti-Semitic Incident:Harassment,New York,New York,NY,36,Kings,47,,, and had glass bottle thrown at him.
1316,9,Anti-Semitic Incident:Harassment,Highland Park,New Jersey,NJ,34,Middlesex,23,,,Police Department Communication fax machine received 12 copies of fax containing anti-Semitic material.
61,9,Anti-Semitic Incident:Vandalism,Beverly Hills,California,CA,6,Los Angeles,37,,,Swastika drawn in dust on a parked car.
1134,9,Anti-Semitic Incident:Vandalism,New Carrollton,Maryland,MD,24,Prince Georges,33,,,Magnets and message promoting knowledge about Judaism were removed from a vehicle and left on the ground.
2478,9,Anti-Semitic Incident:Vandalism,Los Angeles,California,CA,,Los Angeles,37,,,Confidential
307,9,Anti-Semitic Incident:Harassment,Boulder,Colorado,CO,8,Boulder,13,,,Jewish student at public high school was target of anti-Semitic harassment in a Facebook group chat.
1469,9,Anti-Semitic Incident:Harassment,New York,New York,NY,36,Kings,47,,,Jewish institution received anti-Semitic phone call.
1713,9,Anti-Semitic Incident:Vandalism,New Brunswick,New Jersey,NJ,34,Middlesex,23,,,Swastika vandalism discovered on campus.
2607,9,Anti-Semitic Incident:Harassment,Richmond,Virginia,VA,51,Richmond city,760,,,Yard sale signs on telephone pole discouraged Jews from attending.
1485,9,Anti-Semitic Incident:Vandalism,New York,New York,NY,36,Kings,47,,,Swastikas drawn on religious papers at nursing home.
1377,9,Anti-Semitic Incident:Harassment,Los Angeles,California,CA,6,Los Angeles,37,,,Confidential
1274,9,Anti-Semitic Incident:Harassment,Lancaster,Pennsylvania,PA,42,Lancaster,71,,,Synagogue received hate literature in the mail.
449,9,Anti-Semitic Incident:Vandalism,Washington,District Of Columbia,DC,11,District of Columbia,1,,, found outside building.
1686,9,Anti-Semitic Incident:Vandalism,Narberth,Pennsylvania,PA,42,Montgomery,91,,,"Business establishment's mezuzah stolen on two occasions, once during the Jewish High Holidays."
1648,9,Anti-Semitic Incident:Vandalism,Moorestown,New Jersey,NJ,,Burlington,5,,,"Jewish family's car vandalized, including a swastika."
2346,9,Anti-Semitic Incident:Harassment,St. Louis,Missouri,MO,29,St. Louis city,510,,,"At least ten different synagogues and day schools received anti-Semitic, anti-government mailings over a period of two months."
1887,9,Anti-Semitic Incident:Vandalism,Palm Springs,California,CA,6,Riverside,65,,,Two swastikas spray-painted onto a storefront.
1399,9,Anti-Semitic Incident:Harassment,Lakewood,New Jersey,NJ,34,Ocean,29,,,Individual victim of anti-Semitic harassment and assault after vehicle accident.
262,9,Anti-Semitic Incident:Harassment,Blue Bell,Pennsylvania,PA,42,Montgomery,91,,,Synagogue received hate literature in the mail.
198,9,Anti-Semitic Incident:Vandalism,Los Angeles,California,CA,6,Los Angeles,37,,, spray-painted on vehicle.
2052,9,Anti-Semitic Incident:Vandalism,Queens,New York,NY,,Queens,81,,,Public transit vandalized with swastika.
2427,9,Anti-Semitic Incident:Harassment,Tampa,Florida,FL,12,Hillsborough,57,,,
229,9,Anti-Semitic Incident:Harassment,Berkeley,California,CA,6,Alameda,1,,,Anti-Semitic flyers distributed on UC Berkeley campus in the wake of controversy over anti-Israel student-run course.
1152,9,Anti-Semitic Incident:Harassment,Jacksonville,Florida,FL,12,Duval,31,,,Anti-Semitic flyers distributed to homes in a residential neighborhood.
261,9,Anti-Semitic Incident:Vandalism,Oceanside,California,CA,6,San Diego,73,,,Swastika spray-painted at a location frequented by a Jewish man.
1401,9,Anti-Semitic Incident:Harassment,Lakewood,New Jersey,NJ,34,Ocean,29,,,Jewish individual victim of anti-Semitic harassment after car accident.
2155,9,Anti-Semitic Incident:Harassment,San Diego,California,CA,6,San Diego,73,,,
41,9,Anti-Semitic Incident:Harassment,Allentown,Pennsylvania,PA,42,Lehigh,77,,,Synagogue received hate literature in the mail.
1121,9,Anti-Semitic Incident:Harassment,Forest Hill,Maryland,MD,,Harford,25,,,
822,9,Terrorist Plot/Attack;Extremist/Police Shootout,Elizabeth,New Jersey,NJ,34,Union,39,Islamist,,"Ahmad Khan Rahimi was arrested after a shootout in which Rahimi allegedly shot and wounded two officers. Rahimi was wanted as a suspect in two bombings that injured 31 people, one in Manhattan and the other at a marine charity race in Seaside, NJ. Rahimi had also planted a bag of pipe bombs in Elizabeth, NJ."
1957,9,Anti-Semitic Incident:Harassment,Hadley,Massachusetts,MA,,Hampshire,15,,,Trivia host at restaurant made an anti-Semitic joke.
1030,9,Anti-Semitic Incident:Harassment,Harrisburg,Pennsylvania,PA,42,Dauphin,43,,,Synagogue received hate literature in the mail.
1859,9,Anti-Semitic Incident:Harassment,Orinda,California,CA,6,Contra Costa,13,,, on social media.
7,9,Anti-Semitic Incident:Harassment,Tucson,Arizona,AZ,4,Pima,19,,,Roadside memorial displayed swastikas and helmets.
1242,9,Anti-Semitic Incident:Harassment,Lake City,Minnesota,MN,27,Wabasha,157,,,Building manager made disparaging and anti-Semitic comments about Jewish tenant.
2480,9,Anti-Semitic Incident:Harassment,Toms River,New Jersey,NJ,34,Ocean,29,,,Jewish individual victim of anti-Semitic verbal harassment while grocery shopping.
1700,9,Anti-Semitic Incident:Harassment,New Bedford,Massachusetts,MA,25,Bristol,5,,,Individual made anti-Semitic comment in front of Jewish woman.
1513,9,Anti-Semitic Incident:Harassment,Marlton,New Jersey,NJ,34,Burlington,5,,,Synagogue received anti-Semitic hate literature.
2406,9,Anti-Semitic Incident:Vandalism,Swarthmore,Pennsylvania,PA,42,Delaware,45,,,Confidential.
607,9,Anti-Semitic Incident:Vandalism,Collingswood,New Jersey,NJ,34,Camden,7,,,Swastika graffiti discovered on pipe on side of school building.
1375,9,Anti-Semitic Incident:Harassment,Los Angeles,California,CA,6,Los Angeles,37,,,Confidential
2444,9,Extremist/Police Shootout,Taylor,Michigan,MI,26,Wayne,163,Right Wing (Anti-Government),,Police shot and killed self-described sovereign citizen Richard Parent after he pointed a weapon at them following a high-speed chase. Parent had been stopped by police for a suspected seat belt violation.
788,9,Anti-Semitic Incident:Harassment,East Brunswick,New Jersey,NJ,,Middlesex,23,,, as username in class game projected onto smartboard.
2685,9,Anti-Semitic Incident:Harassment,Wilmington,Delaware,DE,10,New Castle,3,,,Synagogue received anti-Semitic hate literature.
1115,9,Anti-Semitic Incident:Assault,Howell,New Jersey,NJ,,Monmouth,25,,,
2025,9,Anti-Semitic Incident:Vandalism,Queens,New York,NY,,Queens,81,,,Residential building vandalized with swastika.
2110,9,Terrorist Plot/Attack,St. Cloud,Minnesota,MN,27,Stearns,145,Islamist,,"Dahir Adan stabbed 10 people in a St. Cloud, MN, mall before being shot to death by an off-duty law enforcement officer"
144,9,Anti-Semitic Incident:Harassment,Aurora,Colorado,CO,8,Arapahoe,5,,,Jewish individual subjected to anti-Semitic harassment by their supervisor.
1012,10,Anti-Semitic Incident:Harassment,Greenwich,Connecticut,CT,9,Fairfield,1,,,Synagogue received letter containing anti-Semitic conspiracies.
2568,10,Anti-Semitic Incident:Harassment,Pittsburgh,Pennsylvania,PA,42,Allegheny,3,,,Jewish attorney's advertisements vandalized with anti-Semitic comments and markings.
1200,10,Anti-Semitic Incident:Harassment,St. Paul,Minnesota,MN,,Ramsey,123,,,
2616,10,Anti-Semitic Incident:Vandalism,Wellesley,Massachusetts,MA,25,Norfolk,21,,,Swastika etched into computer at a high school.
2637,10,Anti-Semitic Incident:Harassment,West Palm Beach,Florida,FL,12,Palm Beach,99,,,Middle school student was the victim of anti-Semitic bullying at school and targeted on social media.
388,10,Anti-Semitic Incident:Harassment,Kent,Connecticut,CT,,Litchfield,5,,,Flyers for anti-Semitic website found on telephone pole.
875,10,Anti-Semitic Incident:Harassment,Farmington,Connecticut,CT,,Hartford,3,,,Director of Jewish organization received anonymous letter filled with anti-Semitic papers at his residence.
1141,10,Anti-Semitic Incident:Harassment,Indio,California,CA,6,Riverside,65,,,High school student reportedly wore a Nazi uniform to school for Halloween.
826,10,Anti-Semitic Incident:Harassment,Elkins Park,Pennsylvania,PA,,Montgomery,42,,,Rabbi targeted with anti-Semitic tweets advancing anti-Jewish conspiracy theories.
202,10,Anti-Semitic Incident:Vandalism,Los Angeles,California,CA,6,Los Angeles,37,,,A Star of David and a hijab were spray-painted on a poster.
1898,10,Anti-Semitic Incident:Vandalism,Parkland,Florida,FL,12,Broward,11,,,Synagogue was vandalized.
323,10,Anti-Semitic Incident:Harassment,Branford,Connecticut,CT,,New Haven,9,,,Confidential
2122,10,Extremist Murder,Salinas,California,CA,,Monterey,53,Right Wing (White Supremacist),Aryan Brotherhood,Inmates Brant Quentin Daniel (an Aryan Brotherhood member) and Leonard Dunning murdered a fellow inmate who was also identified as a member of a gang.
397,10,Anti-Semitic Incident:Harassment,Windsor Locks,Connecticut,CT,9,Hartford,3,,,Two individuals harassed Jewish family at an airport.
402,10,Anti-Semitic Incident:Vandalism,Brooklyn,New York,NY,,Kings,47,,,Hallway in apartment building vandalized with swastika.
1379,10,Anti-Semitic Incident:Harassment,Los Angeles,California,CA,6,Los Angeles,37,,,"Lay leaders in Los Angeles, San Diego, and Seattle received an email claiming Jews are overrepresented in high finance, politics and media."
610,10,Anti-Semitic Incident:Harassment,Colorado Springs,Colorado,CO,8,El Paso,41,,,Anti-Semitic rhetoric and conspiracies used in a sermon at a church.
806,10,Anti-Semitic Incident:Harassment,Easton,Pennsylvania,PA,42,Northampton,95,,,Synagogue received hate literature in the mail.
1331,10,Anti-Semitic Incident:Harassment,Littleton,Colorado,CO,8,Arapahoe,5,,,High school student victim of anti-Semitic harassment and bullying by another student.
2528,10,Anti-Semitic Incident:Vandalism,Los Angeles,California,CA,,Los Angeles,37,,, graffitied on business.
350,10,Anti-Semitic Incident:Harassment,San Francisco,California,CA,6,San Francisco,75,,,
1792,10,Anti-Semitic Incident:Vandalism,Los Angeles,California,CA,,Los Angeles,37,,,Building vandalized with swastika graffiti.
8163,10,Extremist Murder,Susanville,California,CA,6,Lassen,35,Right Wing (White Supremacist),Aryan Brotherhood,"At the orders of the Aryan Brotherhood, an AB associate, Bobby Stockton, reportedly stabbed to death an AB member at High Desert State Prison who had allegedly broken AB rules."
42,10,Anti-Semitic Incident:Harassment,Allentown,Pennsylvania,PA,42,Lehigh,77,,,Synagogue received hate literature in the mail.
1527,10,Anti-Semitic Incident:Vandalism,Medway,Massachusetts,MA,,Norfolk,21,,,Swastika etched into structure at a high school.
793,10,Anti-Semitic Incident:Vandalism,East Garden City,New York,NY,36,Nassau,59,,,School restroom vandalized with swastikas.
1471,10,Anti-Semitic Incident:Harassment,New York,New York,NY,36,Kings,47,,,Anti-Semitic article targeted New York Attorney General Eric Schneiderman.
834,10,Anti-Semitic Incident:Harassment,Englewood,New Jersey,NJ,34,Bergen,3,,,Synagogue received anti-Semitic hate literature.
833,10,Anti-Semitic Incident:Harassment,Englewood,New Jersey,NJ,34,Bergen,3,,,Synagogue received anti-Semitic hate literature.
743,10,Anti-Semitic Incident:Harassment,Denver,Colorado,CO,8,Denver,31,,,Anti-Semitic conspiracy-filled letter sent to ADL office.
904,10,Anti-Semitic Incident:Harassment,Fort Lee,New Jersey,NJ,34,Bergen,3,,,Synagogue received anti-Semitic hate literature.
344,10,Anti-Semitic Incident:Harassment,Brookline,Massachusetts,MA,25,Norfolk,21,,,Anti-Semitic flyer sent to private residence.
740,10,Anti-Semitic Incident:Harassment,Denver,Colorado,CO,8,Denver,31,,,Synagogue received an anti-Semitic letter.
602,10,Anti-Semitic Incident:Vandalism,College Station,Texas,TX,48,Brazos,41,,,Jewish campus organization's sign pulled down and defaced at Texas A&M University.
2468,10,Anti-Semitic Incident:Harassment,Tenafly,New Jersey,NJ,34,Bergen,3,,,Synagogue received anti-Semitic hate literature.
1847,10,Anti-Semitic Incident:Harassment,Omaha,Nebraska,NE,31,Douglas,55,,,Synagogue received anti-Semitic hate mail.
1885,10,Anti-Semitic Incident:Harassment,Palm Beach Gardens,Florida,FL,12,Palm Beach,99,,,Synagogue received hate mail.
308,10,Anti-Semitic Incident:Harassment,Boulder,Colorado,CO,8,Boulder,13,,,Several synagogues received anti-Semitic flyers.
112,10,Anti-Semitic Incident:Harassment,Atlanta,Georgia,GA,13,Fulton,121,,,Elementary school student victim of anti-Semitic bullying by peer.
1247,10,Anti-Semitic Incident:Harassment,Lake Worth,Florida,FL,12,Palm Beach,99,,,Jewish members of a housing association harassed by other members.
290,10,Anti-Semitic Incident:Harassment,Boston,Massachusetts,MA,25,Suffolk,25,,,White supremacist group left flyers around campus.
741,10,Anti-Semitic Incident:Harassment,Denver,Colorado,CO,8,Denver,31,,,Jewish lay-leader received anti-Semitic mail.
2077,10,Anti-Semitic Incident:Vandalism,Levittown,New York,NY,36,Nassau,59,,,Playground vandalized with swastika.
1940,10,Anti-Semitic Incident:Vandalism,Brooklyn,New York,NY,,Kings,47,,,Public transit vandalized with swastika.
1529,10,Anti-Semitic Incident:Vandalism,Atlantic Beach,New York,NY,36,Nassau,59,,,Street sign vandalized with anti-Semitic markings.
2709,10,Anti-Semitic Incident:Harassment,Wyomissing,Pennsylvania,PA,42,Berks,11,,,Synagogue received hate literature in the mail.
1491,10,Anti-Semitic Incident:Harassment,South Brunswick,New Jersey,NJ,,Middlesex,23,,,Confidential
363,10,Anti-Semitic Incident:Harassment,Walnut Creek,California,CA,6,Contra Costa,13,,,Anti-Semitic leaflet found on a car promoted an anti-Semitic and anti-Italian conspiracy.
2411,10,Anti-Semitic Incident:Vandalism,Stewart Manor,New York,NY,36,Nassau,59,,,Sidewalk vandalized with swastika.
886,10,Terrorist Plot/Attack,Florence,Arizona,AZ,4,Pinal,21,Islamist,,Thomas Bastian plotted to detonate a bomb in the prison where he was incarcerated; he was going to use al-Qaeda's Inspire magazine to construct the bomb.
2679,10,Anti-Semitic Incident:Vandalism,Wildomar,California,CA,6,Riverside,65,,, and a drawing of a penis were written on a elementary school wall.
1284,10,Anti-Semitic Incident:Harassment,Larkspur,California,CA,6,Marin,41,,,Middle school student had a piece of paper with a swastika drawn on it placed in his backpack during the school day.
517,10,Anti-Semitic Incident:Harassment,Cherry Hill,New Jersey,NJ,,Camden,7,,,Synagogue received anti-Semitic hate literature.
46,10,Anti-Semitic Incident:Harassment,Alpharetta,Georgia,GA,13,Fulton,121,,,Middle school students harassed other students with anti-Semitic jokes.
2698,10,Anti-Semitic Incident:Harassment,Woodbridge,Connecticut,CT,,New Haven,9,,,Individual shouted anti-Semitic slurs while driving past a synagogue.
2448,10,Anti-Semitic Incident:Harassment,Teaneck,New Jersey,NJ,,Bergen,3,,,Synagogue received anti-Semitic hate literature.
742,10,Anti-Semitic Incident:Harassment,Denver,Colorado,CO,8,Denver,31,,,Jewish organization received an anti-Semitic letter.
805,10,Anti-Semitic Incident:Vandalism,Andover,Massachusetts,MA,25,Essex,9,,,Four individuals spray-painted swastikas on building.
1283,10,Anti-Semitic Incident:Vandalism,Harrison,New Jersey,NJ,,Hudson,17,,, found on gazebo in public park.
2149,10,Anti-Semitic Incident:Assault,San Diego,California,CA,6,San Diego,73,,," and harassed him via social media, referencing Hitler and ovens."
5,10,Anti-Semitic Incident:Harassment,Phoenix,Arizona,AZ,4,Maricopa,13,,,Elected official made a Nazi comparison.
2507,10,Anti-Semitic Incident:Vandalism,Union,New Jersey,NJ,,Union,39,,,Swastikas painted on home of Jewish individual.
962,10,Terrorist Plot/Attack,Garden City,Kansas,KS,20,Finney,55,Right Wing (Anti-Government),,"Three members of a small militia group called The Crusaders, Curtis Allen, Gavin Wright and Patrick Eugene Stein, were arrested in October 2016 in connection with an alleged terrorist plot to use truck bombs to blow up an apartment complex inhabited primarily by Somali immigrants, where a small mosque was located. In April 2018, a jury convicted the three of one count of conspiracy to use a weapon of mass destruction and one count of conspiracy against civil rights."
2697,10,Anti-Semitic Incident:Harassment,Woodbridge,Connecticut,CT,,New Haven,9,,,Synagogue received letter filled with anti-Semitic conspiracies.
529,10,Anti-Semitic Incident:Vandalism,Chicago,Illinois,IL,17,Cook,31,,, left outside Jewish organization at university.
7634,10,Terrorist Plot/Attack,Nederland,Colorado,CO,8,Boulder,13,Left Wing,,"David Ansberry received a 27-year sentence in January 2019 for a 2016 attempt to explode a bomb outside a police station in Nederland, Colorado, in retaliation for the 1971 death of a friend at the hands of a police officer."
2538,10,Anti-Semitic Incident:Vandalism,Vineland,New Jersey,NJ,34,Cumberland,11,,, painted on vacant office building connected to Jewish-owned law office.
241,10,Anti-Semitic Incident:Harassment,San Diego,California,CA,6,San Diego,73,,,Synagogue was emailed dozens of pages of anti-Semitic Christian literature calling for the Jews to repent for their sins.
776,10,Anti-Semitic Incident:Harassment,Dunwoody,Georgia,GA,13,DeKalb,89,,,Synagogue received anti-Semitic letter.
1031,10,Anti-Semitic Incident:Harassment,Harrisburg,Pennsylvania,PA,42,Dauphin,43,,,Synagogue received hate literature in the mail.
717,10,Anti-Semitic Incident:Harassment,Decatur,Georgia,GA,13,DeKalb,89,,,Non-profit received anti-Semitic messages and their names were posted on the alt-right site Stormfront.
270,10,Anti-Semitic Incident:Harassment,Boca Raton,Florida,FL,12,Palm Beach,99,,,Student harassed other students and drew swastikas on notebooks.
2280,10,Anti-Semitic Incident:Harassment,Sharon,Massachusetts,MA,25,Norfolk,21,,,Anti-Semitic flyer sent to Jewish school.
2525,10,Anti-Semitic Incident:Harassment,Los Angeles,California,CA,,Los Angeles,37,,,Confidential
669,10,Terrorist Plot/Attack,Cranford,New Jersey,NJ,,Union,39,Islamist,,"Abdulrahman el-Bahnasawy plotted to carry out terrorist attacks in New York City, including in the subway, during Ramadan in support of ISIS. ."
1663,10,Anti-Semitic Incident:Vandalism,Mount Pleasant,South Carolina,SC,45,Charleston,19,,, drawn in middle school bathroom.
111,10,Anti-Semitic Incident:Harassment,Atlanta,Georgia,GA,13,Fulton,121,,,
2558,10,Anti-Semitic Incident:Vandalism,Warwick,New York,NY,36,Orange,71,,, before Yom Kippur.
2450,10,Anti-Semitic Incident:Harassment,Teaneck,New Jersey,NJ,,Bergen,3,,,Synagogue received anti-Semitic hate literature.
1239,10,Anti-Semitic Incident:Harassment,Laguna Niguel,California,CA,6,Orange,59,,,
1380,10,Anti-Semitic Incident:Harassment,Los Angeles,California,CA,6,Los Angeles,37,,,Confidential
1381,10,Anti-Semitic Incident:Harassment,Los Angeles,California,CA,6,Los Angeles,37,,,Confidential
889,10,Anti-Semitic Incident:Harassment,Boston,Massachusetts,MA,25,Suffolk,25,,,Men protested with anti-Semitic signs in front of bank.
1573,10,Anti-Semitic Incident:Harassment,Midland,Michigan,MI,26,Midland,111,,,University professor repeatedly told class the Holocaust never happened and the Jews made it up.
1064,10,Terrorist Plot/Attack,Hilliard,Ohio,OH,39,Franklin,49,Right Wing (White Supremacist),,"John L. Staley III was arrested for plotting a mass shooting at his high school in the Columbus, OH suburb of Hilliard. He was charged with a delinquency count of conspiracy to commit murder. In January 2018, Staley (later charged as an adult) entered a no contest plea to one count of conspiracy to commit murder; the following month, he was sentenced to four years in adult prison."
317,10,Anti-Semitic Incident:Harassment,Boynton Beach,Florida,FL,12,Palm Beach,99,,,Synagogue received anti-Semitic hate literature.
1924,10,Anti-Semitic Incident:Vandalism,Brooklyn,New York,NY,,Kings,47,,, and physically assaulted by passersby.
2221,10,Anti-Semitic Incident:Harassment,Sandy,Utah,UT,49,Salt Lake,35,,,Jewish student overheard anti-Semitic joke regarding the Holocaust at school.
931,10,Anti-Semitic Incident:Harassment,Franklin Lakes,New Jersey,NJ,34,Bergen,3,,,Synagogue received anti-Semitic hate literature.
2621,10,Anti-Semitic Incident:Harassment,West Hempstead,New York,NY,36,Nassau,59,,,Anti-Semitic business cards left at business establishment.
2705,10,Anti-Semitic Incident:Vandalism,Whitefish Bay,Wisconsin,WI,55,Milwaukee,79,,,Swastikas painted on sidewalk.
902,10,Anti-Semitic Incident:Harassment,Fort Lauderdale,Florida,FL,12,Broward,11,,, and told to cross the street.
1132,10,Terrorist Plot/Attack,Hyattsville,Maryland,MD,24,Prince Georges,33,Islamist,,Nelash Mohamed Das plotted to kill a Prince George-based military member with a firearm. He expressed interest in multiple killings targeting U.S. military personnel.
1187,10,Anti-Semitic Incident:Harassment,Ann Arbor,Michigan,MI,26,Washtenaw,161,,,Jewish student heard shouting outside his house about Jews controlling economy and other anti-Semitic stereotypes.
462,10,Anti-Semitic Incident:Harassment,Carlsbad,California,CA,6,San Diego,73,,,
590,10,Anti-Semitic Incident:Harassment,Closter,New Jersey,NJ,34,Bergen,3,,,Synagogue received anti-Semitic hate literature.
2192,10,Anti-Semitic Incident:Vandalism,San Francisco,California,CA,6,San Francisco,75,,,Anti-Semitic graffiti found twice at the entrance of Jewish organization.
272,10,Anti-Semitic Incident:Harassment,Boca Raton,Florida,FL,12,Palm Beach,99,,,Individual received anti-Semitic flyer at her house.
2447,10,Anti-Semitic Incident:Harassment,Teaneck,New Jersey,NJ,,Bergen,3,,,Synagogue received anti-Semitic hate literature.
2428,10,Anti-Semitic Incident:Vandalism,Tampa,Florida,FL,12,Hillsborough,57,,,Flag desecrated with anti-Semitic graffiti and left on the steps outside a synagogue.
1090,10,Anti-Semitic Incident:Harassment,Houston,Texas,TX,48,Harris,201,,,Confidential
989,10,Anti-Semitic Incident:Harassment,Newton,Massachusetts,MA,25,Middlesex,17,,,Anti-Semitic images and statements found on hacked Google document of middle school student.
498,10,Anti-Semitic Incident:Harassment,Charlotte,North Carolina,NC,37,Mecklenburg,119,,,A Nazi flag was hung from a residence hall at UNC Charlotte.
271,10,Anti-Semitic Incident:Harassment,Boca Raton,Florida,FL,12,Palm Beach,99,,,"Congressman received an anti-Semitic phone call at his residence, discussing Jewish conspiracies and involvement in world atrocities."
2446,10,Anti-Semitic Incident:Harassment,Teaneck,New Jersey,NJ,,Bergen,3,,,Synagogue received anti-Semitic hate literature.
2449,10,Anti-Semitic Incident:Harassment,Teaneck,New Jersey,NJ,,Bergen,3,,,Synagogue received anti-Semitic hate literature.
2364,10,Anti-Semitic Incident:Harassment,State College,Pennsylvania,PA,42,Centre,27,,,Synagogue received hate literature in the mail.
675,10,Terrorist Plot/Attack,Crown Point,Indiana,IN,18,Lake,89,Islamist,,"Marlon Hicks wanted to travel to join ISIS, but instead provided information and supplies to a U.S. government source, believing the source would carry out an attack in the U.S. using explosives."
1665,10,Anti-Semitic Incident:Harassment,Mountain View,California,CA,6,Santa Clara,85,,,Audience members at a Roger Waters concert made anti-Semitic comments.
1777,10,Anti-Semitic Incident:Vandalism,Newton,Massachusetts,MA,,Middlesex,17,,,Swastika made of rubber pellets found on bench near school athletic field.
1929,10,Anti-Semitic Incident:Vandalism,Brooklyn,New York,NY,,Kings,47,,,Vehicle was vandalized with four swastikas and other obscene images.
